{
  "budget": "verified_pipeline_v2:4fc5421244b900bd",
  "model_portfolio": "chatgpt-ui-unrecorded",
  "parent_problem_id": "erdos-945",
  "parent_run_contract_id": null,
  "part_index": 2,
  "pipeline_version": "pipeline-content-sha256:c47624a865d6293e2bc197d23e5c254726607fc551b5044240a65ea44240e6f7",
  "priority_score": 0.113821,
  "problem_number": 945,
  "rank": 100,
  "recommended_attack_modes": [
    "statement_audit",
    "human_clarification",
    "formal_search",
    "subproblem_decomposition",
    "shared_infrastructure_search"
  ],
  "run_contract_id": null,
  "schema_version": 2,
  "snapshot_id": "20260712-00e292c67dca",
  "statement": {
    "focus_question": "\\]In other words, is there a constant $C>0$ such that, for all large $x$, every interval $[x,x+(\\log x)^C]$ contains two integers with the same number of divisors?",
    "focus_question_sha256": "5097837a6ab906ed3798dbdccc4eeacdd4942176502101f904163f6965e7f3c1",
    "normalized": "Let $F(x)$ be the maximal $k$ such that there exist $n+1,\\ldots,n+k\\leq x$ with $\\tau(n+1),\\ldots,\\tau(n+k)$ all distinct (where $\\tau(m)$ counts the divisors of $m$). Estimate $F(x)$. In particular, is it true that\\[F(x) \\leq (\\log x)^{O(1)}?\\]In other words, is there a constant $C>0$ such that, for all large $x$, every interval $[x,x+(\\log x)^C]$ contains two integers with the same number of divisors?",
    "original": "Let $F(x)$ be the maximal $k$ such that there exist $n+1,\\ldots,n+k\\leq x$ with $\\tau(n+1),\\ldots,\\tau(n+k)$ all distinct (where $\\tau(m)$ counts the divisors of $m$). Estimate $F(x)$. In particular, is it true that\\[F(x) \\leq (\\log x)^{O(1)}?\\]In other words, is there a constant $C>0$ such that, for all large $x$, every interval $[x,x+(\\log x)^C]$ contains two integers with the same number of divisors?",
    "statement_sha256": "b00bf2977018a92dee0b405473a100a7b84bc0faf6a504b53f5231fe78f42071"
  },
  "subproblem_contract_sha256": "0b3bf5b4f1d5161ecc585e89b755030faff6150c21f66bf3bf8710e8f48d6b0e",
  "subproblem_id": "erdos-945-part-02-0b3bf5b4"
}
