{
  "budget": "verified_pipeline_v2:4fc5421244b900bd",
  "model_portfolio": "chatgpt-5.6",
  "parent_problem_id": "erdos-357",
  "parent_run_contract_id": "d53b4596d9a7666f829dda6852e3e0f746fe06c2c6021eee0ff15f7295ce1748",
  "part_index": 1,
  "pipeline_version": "pipeline-content-sha256:d992243e6d1124da98218807bbcc1fed50496af96476673546f17c5c2eddd843",
  "priority_score": 0.113821,
  "problem_number": 357,
  "rank": 53,
  "recommended_attack_modes": [
    "statement_audit",
    "human_clarification",
    "formal_search",
    "subproblem_decomposition",
    "shared_infrastructure_search"
  ],
  "run_contract_id": "441ddbfb5f3c248ccba5c83fa9e0b1b8cb05f95c732176e68f115b2409abf9f5",
  "schema_version": 2,
  "snapshot_id": "20260713-deb58d0facd9",
  "statement": {
    "focus_question": "Let $1\\leq a_1<\\cdots <a_k\\leq n$ be integers such that all sums of the shape $\\sum_{u\\leq i\\leq v}a_i$ are distinct. Let $f(n)$ be the maximal such $k$. How does $f(n)$ grow?",
    "focus_question_sha256": "769984ee90afc1f08430d7b85bd54503bb566c4348759f6ce1fcf2474df1211a",
    "normalized": "Let $1\\leq a_1<\\cdots <a_k\\leq n$ be integers such that all sums of the shape $\\sum_{u\\leq i\\leq v}a_i$ are distinct. Let $f(n)$ be the maximal such $k$. How does $f(n)$ grow? Is $f(n)=o(n)$?",
    "original": "Let $1\\leq a_1<\\cdots <a_k\\leq n$ be integers such that all sums of the shape $\\sum_{u\\leq i\\leq v}a_i$ are distinct. Let $f(n)$ be the maximal such $k$.\n\nHow does $f(n)$ grow? Is $f(n)=o(n)$?",
    "statement_sha256": "d4c6ff7637cb06aea199ee58c0264d62707b029aad04cecb7b46e5e0ac7457c8"
  },
  "subproblem_contract_sha256": "00f89a2efa67a061d0579da74f762c39ae1bed5ce74f4a9acc7be02001988590",
  "subproblem_id": "erdos-357-part-01-00f89a2e"
}
