{
  "budget": "verified_pipeline_v2:4fc5421244b900bd",
  "model_portfolio": "chatgpt-ui-unrecorded",
  "parent_problem_id": "erdos-514",
  "parent_run_contract_id": null,
  "part_index": 1,
  "pipeline_version": "pipeline-content-sha256:c47624a865d6293e2bc197d23e5c254726607fc551b5044240a65ea44240e6f7",
  "priority_score": 0.057971,
  "problem_number": 514,
  "rank": 292,
  "recommended_attack_modes": [
    "statement_audit",
    "human_clarification",
    "exact_construction_search",
    "construction_verification",
    "subproblem_decomposition",
    "shared_infrastructure_search",
    "literature_search"
  ],
  "run_contract_id": null,
  "schema_version": 2,
  "snapshot_id": "20260712-00e292c67dca",
  "statement": {
    "focus_question": "Let $f(z)$ be an entire transcendental function. Does there exist a path $L$ so that, for every $n$,\\[\\lvert f(z)/z^n\\rvert \\to \\infty\\]as $z\\to \\infty$ along $L$?",
    "focus_question_sha256": "5fe07b3846535099a1e1150e076906aff1e57d2d2886c4e2dbd8fbab9d2ae34a",
    "normalized": "Let $f(z)$ be an entire transcendental function. Does there exist a path $L$ so that, for every $n$,\\[\\lvert f(z)/z^n\\rvert \\to \\infty\\]as $z\\to \\infty$ along $L$? Can the length of this path be estimated in terms of $M(r)=\\max_{\\lvert z\\rvert=r}\\lvert f(z)\\rvert$? Does there exist a path along which $\\lvert f(z)\\rvert$ tends to $\\infty$ faster than a fixed function of $M(r)$ (such that $M(r)^\\epsilon$)?",
    "original": "Let $f(z)$ be an entire transcendental function. Does there exist a path $L$ so that, for every $n$,\\[\\lvert f(z)/z^n\\rvert \\to \\infty\\]as $z\\to \\infty$ along $L$?\n\nCan the length of this path be estimated in terms of $M(r)=\\max_{\\lvert z\\rvert=r}\\lvert f(z)\\rvert$? Does there exist a path along which $\\lvert f(z)\\rvert$ tends to $\\infty$ faster than a fixed function of $M(r)$ (such that $M(r)^\\epsilon$)?",
    "statement_sha256": "8c41ebd0626736dd19acf1ec7c03aa0d826970c881a9df1fa92e5d8deb704bb6"
  },
  "subproblem_contract_sha256": "2577f05acb25c48b079c02072305fb80cff28ae9ffd12ea06abd55340e475871",
  "subproblem_id": "erdos-514-part-01-2577f05a"
}
