{
  "budget": "verified_pipeline_v2:4fc5421244b900bd",
  "model_portfolio": "chatgpt-ui-unrecorded",
  "parent_problem_id": "erdos-342",
  "parent_run_contract_id": null,
  "part_index": 3,
  "pipeline_version": "pipeline-content-sha256:c47624a865d6293e2bc197d23e5c254726607fc551b5044240a65ea44240e6f7",
  "priority_score": 0.056911,
  "problem_number": 342,
  "rank": 313,
  "recommended_attack_modes": [
    "statement_audit",
    "human_clarification",
    "formal_search",
    "subproblem_decomposition",
    "shared_infrastructure_search"
  ],
  "run_contract_id": null,
  "schema_version": 2,
  "snapshot_id": "20260712-00e292c67dca",
  "statement": {
    "focus_question": "Does this sequence eventually have periodic differences?",
    "focus_question_sha256": "a73fe9bdccf16ac1d9a5e19a4bc471c2425292b3c5a4eca815714b9e0fc69450",
    "normalized": "With $a_1=1$ and $a_2=2$ let $a_{n+1}$ for $n\\geq 2$ be the least integer $>a_n$ which can be expressed uniquely as $a_i+a_j$ for $i<j\\leq n$. What can be said about this sequence? Do infinitely many pairs $a,a+2$ occur? Does this sequence eventually have periodic differences? Is the density $0$?",
    "original": "With $a_1=1$ and $a_2=2$ let $a_{n+1}$ for $n\\geq 2$ be the least integer $>a_n$ which can be expressed uniquely as $a_i+a_j$ for $i<j\\leq n$.\n\nWhat can be said about this sequence? Do infinitely many pairs $a,a+2$ occur? Does this sequence eventually have periodic differences? Is the density $0$?",
    "statement_sha256": "0d91d77caa6309aecdd60d68bacc2c9652b4717dbb67c2198f563b5e800f9440"
  },
  "subproblem_contract_sha256": "95b3b48a5d59c0a1b332ce1a634ef266337570c1ab2682d08a3512d4388e05f0",
  "subproblem_id": "erdos-342-part-03-95b3b48a"
}
