{
  "budget": "verified_pipeline_v2:4fc5421244b900bd",
  "model_portfolio": "chatgpt-ui-unrecorded",
  "parent_problem_id": "erdos-323",
  "parent_run_contract_id": null,
  "part_index": 1,
  "pipeline_version": "pipeline-content-sha256:c47624a865d6293e2bc197d23e5c254726607fc551b5044240a65ea44240e6f7",
  "priority_score": 0.113821,
  "problem_number": 323,
  "rank": 47,
  "recommended_attack_modes": [
    "statement_audit",
    "human_clarification",
    "formal_search",
    "subproblem_decomposition",
    "shared_infrastructure_search",
    "literature_search"
  ],
  "run_contract_id": null,
  "schema_version": 2,
  "snapshot_id": "20260712-00e292c67dca",
  "statement": {
    "focus_question": "Let $1\\leq m\\leq k$ and $f_{k,m}(x)$ denote the number of integers $\\leq x$ which are the sum of $m$ many nonnegative $k$th powers. Is it true that\\[f_{k,k}(x) \\gg_\\epsilon x^{1-\\epsilon}\\]for all $\\epsilon>0$?",
    "focus_question_sha256": "a2ff1305fe30ec55c9169e36ad9ad3df37afd7b03cc8d37870b4088d660d9501",
    "normalized": "Let $1\\leq m\\leq k$ and $f_{k,m}(x)$ denote the number of integers $\\leq x$ which are the sum of $m$ many nonnegative $k$th powers. Is it true that\\[f_{k,k}(x) \\gg_\\epsilon x^{1-\\epsilon}\\]for all $\\epsilon>0$? Is it true that if $m<k$ then\\[f_{k,m}(x) \\gg x^{m/k}\\]for sufficiently large $x$?",
    "original": "Let $1\\leq m\\leq k$ and $f_{k,m}(x)$ denote the number of integers $\\leq x$ which are the sum of $m$ many nonnegative $k$th powers. Is it true that\\[f_{k,k}(x) \\gg_\\epsilon x^{1-\\epsilon}\\]for all $\\epsilon>0$? Is it true that if $m<k$ then\\[f_{k,m}(x) \\gg x^{m/k}\\]for sufficiently large $x$?",
    "statement_sha256": "d27dec6ca8e2a11dfc0c774e97fa05dbf9cf099fe5da1e0f38eea0e9cc901fce"
  },
  "subproblem_contract_sha256": "3d10bc22d33032e3acc9d3890b43ce44bd26dd1d0272fbb919d38d9f9b51f3b8",
  "subproblem_id": "erdos-323-part-01-3d10bc22"
}
