{
  "budget": "verified_pipeline_v2:4fc5421244b900bd",
  "model_portfolio": "chatgpt-5.6",
  "parent_problem_id": "erdos-302",
  "parent_run_contract_id": "08786bb982f2811d291f251eaf87f7fcb3e385ef729fa1a25deae3cd3b33d90d",
  "part_index": 2,
  "pipeline_version": "pipeline-content-sha256:d992243e6d1124da98218807bbcc1fed50496af96476673546f17c5c2eddd843",
  "priority_score": 0.086957,
  "problem_number": 302,
  "rank": 149,
  "recommended_attack_modes": [
    "statement_audit",
    "human_clarification",
    "subproblem_decomposition",
    "shared_infrastructure_search"
  ],
  "run_contract_id": "42e73e643d099c29acb60aa0c32d9eaf3603ae9f309010b37cd77b89354a3ce0",
  "schema_version": 2,
  "snapshot_id": "20260713-deb58d0facd9",
  "statement": {
    "focus_question": "Estimate $f(N)$. In particular, is $f(N)=(\\tfrac{1}{2}+o(1))N$?",
    "focus_question_sha256": "f13bedbc99a6ccecc2027a8ece574c52cf240fc696b71abda5355c76c6dd25f4",
    "normalized": "Let $f(N)$ be the size of the largest $A\\subseteq \\{1,\\ldots,N\\}$ such that there are no solutions to\\[\\frac{1}{a}= \\frac{1}{b}+\\frac{1}{c}\\]with distinct $a,b,c\\in A$? Estimate $f(N)$. In particular, is $f(N)=(\\tfrac{1}{2}+o(1))N$?",
    "original": "Let $f(N)$ be the size of the largest $A\\subseteq \\{1,\\ldots,N\\}$ such that there are no solutions to\\[\\frac{1}{a}= \\frac{1}{b}+\\frac{1}{c}\\]with distinct $a,b,c\\in A$?\n\nEstimate $f(N)$. In particular, is $f(N)=(\\tfrac{1}{2}+o(1))N$?",
    "statement_sha256": "7fdfca827ff3ae6a792d3d15fe53f437cb3444206808805f08460dcc1358e1f6"
  },
  "subproblem_contract_sha256": "31d6c362da56d5779db76b76fe5a45aa8717e60c9a3e50cce2e318c9b78d3005",
  "subproblem_id": "erdos-302-part-02-31d6c362"
}
