{
  "budget": "verified_pipeline_v2:4fc5421244b900bd",
  "model_portfolio": "chatgpt-5.6",
  "parent_problem_id": "erdos-1045",
  "parent_run_contract_id": "d0b873ae92aa185007d78dc69f60dd84460a2ebb5e35f83d1aaee1095141bc33",
  "part_index": 1,
  "pipeline_version": "pipeline-content-sha256:d992243e6d1124da98218807bbcc1fed50496af96476673546f17c5c2eddd843",
  "priority_score": 0.10084,
  "problem_number": 1045,
  "rank": 109,
  "recommended_attack_modes": [
    "statement_audit",
    "human_clarification",
    "subproblem_decomposition",
    "shared_infrastructure_search",
    "literature_search"
  ],
  "run_contract_id": "3431cf1ff23813218ea3c553b4690e240f7e21227518a6ab48403a5772954f45",
  "schema_version": 2,
  "snapshot_id": "20260713-deb58d0facd9",
  "statement": {
    "focus_question": "Let $z_1,\\ldots,z_n\\in \\mathbb{C}$ with $\\lvert z_i-z_j\\rvert\\leq 2$ for all $i,j$, and\\[\\Delta(z_1,\\ldots,z_n)=\\prod_{i\\neq j}\\lvert z_i-z_j\\rvert.\\]What is the maximum possible value of $\\Delta$?",
    "focus_question_sha256": "81544e47093e56678efa06cdb87b43cf80d0554a9673df46dff2d2c41d75d7c0",
    "normalized": "Let $z_1,\\ldots,z_n\\in \\mathbb{C}$ with $\\lvert z_i-z_j\\rvert\\leq 2$ for all $i,j$, and\\[\\Delta(z_1,\\ldots,z_n)=\\prod_{i\\neq j}\\lvert z_i-z_j\\rvert.\\]What is the maximum possible value of $\\Delta$? Is it maximised by taking the $z_i$ to be the vertices of a regular polygon?",
    "original": "Let $z_1,\\ldots,z_n\\in \\mathbb{C}$ with $\\lvert z_i-z_j\\rvert\\leq 2$ for all $i,j$, and\\[\\Delta(z_1,\\ldots,z_n)=\\prod_{i\\neq j}\\lvert z_i-z_j\\rvert.\\]What is the maximum possible value of $\\Delta$? Is it maximised by taking the $z_i$ to be the vertices of a regular polygon?",
    "statement_sha256": "2460724b10c1fe18eca094721e10f77f11ae07f54047b42707935c9b0a27939f"
  },
  "subproblem_contract_sha256": "869f570338cd4f5be6222bd9bf26e048af21f0c80ec2c32f8f72bf593143cbaf",
  "subproblem_id": "erdos-1045-part-01-869f5703"
}
