{
  "budget": "verified_pipeline_v2:4fc5421244b900bd",
  "model_portfolio": "chatgpt-5.6",
  "parent_problem_id": "erdos-365",
  "parent_run_contract_id": "0b41e9bb8483416494b08eb7b1d2f1c8c925a46c6ea3c00359df13e19543a220",
  "part_index": 3,
  "pipeline_version": "pipeline-content-sha256:d992243e6d1124da98218807bbcc1fed50496af96476673546f17c5c2eddd843",
  "priority_score": 0.057971,
  "problem_number": 365,
  "rank": 273,
  "recommended_attack_modes": [
    "statement_audit",
    "human_clarification",
    "subproblem_decomposition",
    "shared_infrastructure_search"
  ],
  "run_contract_id": "de907f74f98af55c749897b0fd9528542cfd103ad6ebb4df881044cfd4b93f1b",
  "schema_version": 2,
  "snapshot_id": "20260713-deb58d0facd9",
  "statement": {
    "focus_question": "Is the number of such $n\\leq x$ bounded by $(\\log x)^{O(1)}$?",
    "focus_question_sha256": "3507c40e474327f562f86bee003b5990e35ee76565ed21643f3e250f47192a12",
    "normalized": "Do all pairs of consecutive powerful numbers $n$ and $n+1$ come from solutions to Pell equations? In other words, must either $n$ or $n+1$ be a square? Is the number of such $n\\leq x$ bounded by $(\\log x)^{O(1)}$?",
    "original": "Do all pairs of consecutive powerful numbers $n$ and $n+1$ come from solutions to Pell equations? In other words, must either $n$ or $n+1$ be a square?\n\nIs the number of such $n\\leq x$ bounded by $(\\log x)^{O(1)}$?",
    "statement_sha256": "cecb84c43ad4c75b0f895d9c8a4bbedab13ae5f64ef960588a0a0a3a72bcd300"
  },
  "subproblem_contract_sha256": "72380f5dac2612fce68ee32a9626cfb6df5a6665715a48c241763e7ac32a7eff",
  "subproblem_id": "erdos-365-part-03-72380f5d"
}
