{
  "budget": "verified_pipeline_v2:4fc5421244b900bd",
  "model_portfolio": "chatgpt-5.6",
  "parent_problem_id": "erdos-836",
  "parent_run_contract_id": "e710da495254088660285e1782750b714ae4a48c3c51854d961062dfbf4d5688",
  "part_index": 2,
  "pipeline_version": "pipeline-content-sha256:d992243e6d1124da98218807bbcc1fed50496af96476673546f17c5c2eddd843",
  "priority_score": 0.086957,
  "problem_number": 836,
  "rank": 209,
  "recommended_attack_modes": [
    "statement_audit",
    "human_clarification",
    "subproblem_decomposition",
    "shared_infrastructure_search",
    "literature_search"
  ],
  "run_contract_id": "4a81e7799e7e9fd1cbce3c6077ee68dd6a1f2d2a6749ceb8453302a0fe39e1ed",
  "schema_version": 2,
  "snapshot_id": "20260713-deb58d0facd9",
  "statement": {
    "focus_question": "Must there be two edges which meet in $\\gg r$ many vertices?",
    "focus_question_sha256": "ed591514f7bb7c243c42edb2f4662f37c37c4b04b817357181e270292485e47a",
    "normalized": "Let $r\\geq 2$ and $G$ be a $r$-uniform hypergraph with chromatic number $3$ (that is, there is a $3$-colouring of the vertices of $G$ such that no edge is monochromatic). Suppose any two edges of $G$ have a non-empty intersection. Must $G$ contain $O(r^2)$ many vertices? Must there be two edges which meet in $\\gg r$ many vertices?",
    "original": "Let $r\\geq 2$ and $G$ be a $r$-uniform hypergraph with chromatic number $3$ (that is, there is a $3$-colouring of the vertices of $G$ such that no edge is monochromatic).\n\nSuppose any two edges of $G$ have a non-empty intersection. Must $G$ contain $O(r^2)$ many vertices? Must there be two edges which meet in $\\gg r$ many vertices?",
    "statement_sha256": "f7f4aa53b212c85be31a7968578c73ec4e948db6b370f991123c380b9df0802f"
  },
  "subproblem_contract_sha256": "04776f90cbbe1e5847eb3090592179443618b3b2d66129b80e512fdea7bfdc06",
  "subproblem_id": "erdos-836-part-02-04776f90"
}
