{
  "budget": "verified_pipeline_v2:4fc5421244b900bd",
  "model_portfolio": "chatgpt-5.6",
  "parent_problem_id": "erdos-354",
  "parent_run_contract_id": "4dd4327997ec5358a9e6d7ab7d2b3c3bb1708329a91629e175deaa8fecfbae78",
  "part_index": 2,
  "pipeline_version": "pipeline-content-sha256:d992243e6d1124da98218807bbcc1fed50496af96476673546f17c5c2eddd843",
  "priority_score": 0.075881,
  "problem_number": 354,
  "rank": 242,
  "recommended_attack_modes": [
    "statement_audit",
    "human_clarification",
    "formal_search",
    "subproblem_decomposition",
    "shared_infrastructure_search",
    "literature_search"
  ],
  "run_contract_id": "771b747b4498942556feda23cabcce251d3114cfcfb6af1f2edb7fe10309d857",
  "schema_version": 2,
  "snapshot_id": "20260713-deb58d0facd9",
  "statement": {
    "focus_question": "That is, can all sufficiently large natural numbers $n$ be written as\\[n=\\sum_{s\\in S}\\lfloor 2^s\\alpha\\rfloor+\\sum_{t\\in T}\\lfloor 2^t\\beta\\rfloor\\]for some finite $S,T\\subset \\mathbb{N}$?",
    "focus_question_sha256": "df96c9d4656668ec74ab46bd8a640527aa15d6b182c1e96e1bd525ab53951d61",
    "normalized": "Let $\\alpha,\\beta\\in \\mathbb{R}_{>0}$ such that $\\alpha/\\beta$ is irrational. Is the multiset\\[\\{ \\lfloor \\alpha\\rfloor,\\lfloor 2\\alpha\\rfloor,\\lfloor 4\\alpha\\rfloor,\\ldots\\}\\cup \\{ \\lfloor \\beta\\rfloor,\\lfloor 2\\beta\\rfloor,\\lfloor 4\\beta\\rfloor,\\ldots\\}\\]complete? That is, can all sufficiently large natural numbers $n$ be written as\\[n=\\sum_{s\\in S}\\lfloor 2^s\\alpha\\rfloor+\\sum_{t\\in T}\\lfloor 2^t\\beta\\rfloor\\]for some finite $S,T\\subset \\mathbb{N}$? What if $2$ is replaced by some $\\gamma\\in(1,2)$?",
    "original": "Let $\\alpha,\\beta\\in \\mathbb{R}_{>0}$ such that $\\alpha/\\beta$ is irrational. Is the multiset\\[\\{ \\lfloor \\alpha\\rfloor,\\lfloor 2\\alpha\\rfloor,\\lfloor 4\\alpha\\rfloor,\\ldots\\}\\cup \\{ \\lfloor \\beta\\rfloor,\\lfloor 2\\beta\\rfloor,\\lfloor 4\\beta\\rfloor,\\ldots\\}\\]complete? That is, can all sufficiently large natural numbers $n$ be written as\\[n=\\sum_{s\\in S}\\lfloor 2^s\\alpha\\rfloor+\\sum_{t\\in T}\\lfloor 2^t\\beta\\rfloor\\]for some finite $S,T\\subset \\mathbb{N}$?\n\nWhat if $2$ is replaced by some $\\gamma\\in(1,2)$?",
    "statement_sha256": "b8216aa772a51756830b1aea7a0d31598e44e4962097eb862a546b3f18fa2235"
  },
  "subproblem_contract_sha256": "cbe006cb8431d8348659097a9fa3b122db643039344d5d93894dd69f374a9184",
  "subproblem_id": "erdos-354-part-02-cbe006cb"
}
