{
  "budget": "verified_pipeline_v2:4fc5421244b900bd",
  "model_portfolio": "chatgpt-5.6",
  "parent_problem_id": "erdos-1054",
  "parent_run_contract_id": "be1665ff17ffe1aca55a3897c6a595bdb4071c8c50f842c02e9859d43f6d18ed",
  "part_index": 1,
  "pipeline_version": "pipeline-content-sha256:d992243e6d1124da98218807bbcc1fed50496af96476673546f17c5c2eddd843",
  "priority_score": 0.125984,
  "problem_number": 1054,
  "rank": 5,
  "recommended_attack_modes": [
    "statement_audit",
    "human_clarification",
    "formal_search",
    "subproblem_decomposition",
    "shared_infrastructure_search",
    "literature_search"
  ],
  "run_contract_id": "e61b01c8bb4757da4de41bce610f8561382339209a484a9ed3b18e0589e65d46",
  "schema_version": 2,
  "snapshot_id": "20260713-deb58d0facd9",
  "statement": {
    "focus_question": "Let $f(n)$ be the minimal integer $m$ such that $n$ is the sum of the $k$ smallest divisors of $m$ for some $k\\geq 1$. Is it true that $f(n)=o(n)$?",
    "focus_question_sha256": "35da99daa9a66d1bb5b2a21c3c6037ee3f2ba1090e5e46011fd17b3da001a7b4",
    "normalized": "Let $f(n)$ be the minimal integer $m$ such that $n$ is the sum of the $k$ smallest divisors of $m$ for some $k\\geq 1$. Is it true that $f(n)=o(n)$? Or is this true only for almost all $n$, and $\\limsup f(n)/n=\\infty$?",
    "original": "Let $f(n)$ be the minimal integer $m$ such that $n$ is the sum of the $k$ smallest divisors of $m$ for some $k\\geq 1$.\n\nIs it true that $f(n)=o(n)$? Or is this true only for almost all $n$, and $\\limsup f(n)/n=\\infty$?",
    "statement_sha256": "68bd7164462dda568f306a53f6e60f4395c46c8a5d9b0113222508fdb3817cac"
  },
  "subproblem_contract_sha256": "51ae88f8722d65e06cdb61f39ae990404122e699da008a12085efabd3f06d5d0",
  "subproblem_id": "erdos-1054-part-01-51ae88f8"
}
