{
  "budget": "verified_pipeline_v2:4fc5421244b900bd",
  "model_portfolio": "chatgpt-ui-unrecorded",
  "parent_problem_id": "erdos-420",
  "parent_run_contract_id": null,
  "part_index": 2,
  "pipeline_version": "pipeline-content-sha256:c47624a865d6293e2bc197d23e5c254726607fc551b5044240a65ea44240e6f7",
  "priority_score": 0.057971,
  "problem_number": 420,
  "rank": 284,
  "recommended_attack_modes": [
    "statement_audit",
    "human_clarification",
    "subproblem_decomposition",
    "shared_infrastructure_search",
    "literature_search"
  ],
  "run_contract_id": null,
  "schema_version": 2,
  "snapshot_id": "20260712-00e292c67dca",
  "statement": {
    "focus_question": "Is it true that $F(\\log n,n)$ is everywhere dense in $(1,\\infty)$?",
    "focus_question_sha256": "d8aed2fec6c3b3e2b55d81123e9445ddb5301059e2f2701ee4d59e9973145b76",
    "normalized": "If $\\tau(n)$ counts the number of divisors of $n$ then let\\[F(f,n)=\\frac{\\tau((n+\\lfloor f(n)\\rfloor)!)}{\\tau(n!)}.\\]Is it true that\\[\\lim_{n\\to \\infty}F((\\log n)^C,n)=\\infty\\]for large $C$? Is it true that $F(\\log n,n)$ is everywhere dense in $(1,\\infty)$? More generally, if $f(n)\\leq \\log n$ is a monotonic function such that $f(n)\\to \\infty$ as $n\\to \\infty$, then is $F(f,n)$ everywhere dense?",
    "original": "If $\\tau(n)$ counts the number of divisors of $n$ then let\\[F(f,n)=\\frac{\\tau((n+\\lfloor f(n)\\rfloor)!)}{\\tau(n!)}.\\]Is it true that\\[\\lim_{n\\to \\infty}F((\\log n)^C,n)=\\infty\\]for large $C$? \n\nIs it true that $F(\\log n,n)$ is everywhere dense in $(1,\\infty)$? \n\nMore generally, if $f(n)\\leq \\log n$ is a monotonic function such that $f(n)\\to \\infty$ as $n\\to \\infty$, then is $F(f,n)$ everywhere dense?",
    "statement_sha256": "f57a5ac5b93f264758f7b94a7fa8d4bfc72abd646ff61bd7bdd564a672b76bc5"
  },
  "subproblem_contract_sha256": "59bbf5634cbd85bfe77c1eda164be44761c502473c5b695ed71cdc54050832a4",
  "subproblem_id": "erdos-420-part-02-59bbf563"
}
