{
  "budget": "verified_pipeline_v2:4fc5421244b900bd",
  "model_portfolio": "chatgpt-ui-unrecorded",
  "parent_problem_id": "erdos-361",
  "parent_run_contract_id": null,
  "part_index": 2,
  "pipeline_version": "pipeline-content-sha256:c47624a865d6293e2bc197d23e5c254726607fc551b5044240a65ea44240e6f7",
  "priority_score": 0.113821,
  "problem_number": 361,
  "rank": 58,
  "recommended_attack_modes": [
    "statement_audit",
    "human_clarification",
    "formal_search",
    "subproblem_decomposition",
    "shared_infrastructure_search"
  ],
  "run_contract_id": null,
  "schema_version": 2,
  "snapshot_id": "20260712-00e292c67dca",
  "statement": {
    "focus_question": "Does this depend on $n$ in an irregular way?",
    "focus_question_sha256": "2b66a050361512ed28b7093fd981c32520fbcb2b475176c7d526b2cfb8553fd2",
    "normalized": "Let $c>0$ and $n$ be some large integer. What is the size of the largest $A\\subseteq \\{1,\\ldots,\\lfloor cn\\rfloor\\}$ such that $n$ is not a sum of a subset of $A$? Does this depend on $n$ in an irregular way?",
    "original": "Let $c>0$ and $n$ be some large integer. What is the size of the largest $A\\subseteq \\{1,\\ldots,\\lfloor cn\\rfloor\\}$ such that $n$ is not a sum of a subset of $A$? Does this depend on $n$ in an irregular way?",
    "statement_sha256": "edf13b333520418d999ada87b3a90dbb0a5446d302dd14369b28dd720c6e4c52"
  },
  "subproblem_contract_sha256": "87e6a2ff229c0367cd3372242fb08e887f42b69b9cc853a32d92db56e4f9058d",
  "subproblem_id": "erdos-361-part-02-87e6a2ff"
}
