{
  "budget": "verified_pipeline_v2:4fc5421244b900bd",
  "model_portfolio": "chatgpt-ui-unrecorded",
  "parent_problem_id": "erdos-1191",
  "parent_run_contract_id": null,
  "part_index": 1,
  "pipeline_version": "pipeline-content-sha256:c47624a865d6293e2bc197d23e5c254726607fc551b5044240a65ea44240e6f7",
  "priority_score": 0.107438,
  "problem_number": 1191,
  "rank": 103,
  "recommended_attack_modes": [
    "statement_audit",
    "human_clarification",
    "exact_computation",
    "counterexample_search",
    "subproblem_decomposition",
    "shared_infrastructure_search"
  ],
  "run_contract_id": null,
  "schema_version": 2,
  "snapshot_id": "20260712-00e292c67dca",
  "statement": {
    "focus_question": "Let $A\\subset\\mathbb{N}$ be an infinite Sidon set. Is it true that\\[\\liminf_{x\\to \\infty} \\frac{\\lvert A\\cap [1,x]\\rvert}{x^{1/2}}(\\log x)^{1/2}=0?",
    "focus_question_sha256": "16dc5eba9a9d9bde9ab1226b02372e9b83c85ef0b3ee7d063f1132fc124c82d3",
    "normalized": "Let $A\\subset\\mathbb{N}$ be an infinite Sidon set. Is it true that\\[\\liminf_{x\\to \\infty} \\frac{\\lvert A\\cap [1,x]\\rvert}{x^{1/2}}(\\log x)^{1/2}=0?\\]Does there exist an infinite Sidon set $A$ such that\\[\\liminf_{x\\to \\infty} \\frac{\\lvert A\\cap [1,x]\\rvert}{x^{1/2}}(\\log x)^c>0\\]for some $c>0$?",
    "original": "Let $A\\subset\\mathbb{N}$ be an infinite Sidon set. Is it true that\\[\\liminf_{x\\to \\infty} \\frac{\\lvert A\\cap [1,x]\\rvert}{x^{1/2}}(\\log x)^{1/2}=0?\\]Does there exist an infinite Sidon set $A$ such that\\[\\liminf_{x\\to \\infty} \\frac{\\lvert A\\cap [1,x]\\rvert}{x^{1/2}}(\\log x)^c>0\\]for some $c>0$?",
    "statement_sha256": "cbbe904f2b958d4c73aa50bf9532c6c3bb341e797b7b2b62e8d8d0a22c26c239"
  },
  "subproblem_contract_sha256": "adbc6bcd9599413caa5278b73b70c49f5e56dbc01c21f0b69d816fa49effac3e",
  "subproblem_id": "erdos-1191-part-01-adbc6bcd"
}
