{
  "budget": "verified_pipeline_v2:4fc5421244b900bd",
  "model_portfolio": "chatgpt-ui-unrecorded",
  "parent_problem_id": "erdos-597",
  "parent_run_contract_id": null,
  "part_index": 2,
  "pipeline_version": "pipeline-content-sha256:c47624a865d6293e2bc197d23e5c254726607fc551b5044240a65ea44240e6f7",
  "priority_score": 0.086957,
  "problem_number": 597,
  "rank": 165,
  "recommended_attack_modes": [
    "statement_audit",
    "human_clarification",
    "subproblem_decomposition",
    "shared_infrastructure_search"
  ],
  "run_contract_id": null,
  "schema_version": 2,
  "snapshot_id": "20260712-00e292c67dca",
  "statement": {
    "focus_question": "\\]What about finite $G$?",
    "focus_question_sha256": "97ff7f28b13e2701bc2ca0a339e65208185ad92a84528eac0edf38a9da479b03",
    "normalized": "Let $G$ be a graph on at most $\\aleph_1$ vertices which contains no $K_4$ and no $K_{\\aleph_0,\\aleph_0}$ (the complete bipartite graph with $\\aleph_0$ vertices in each class). Is it true that\\[\\omega_1^2 \\to (\\omega_1\\omega, G)^2?\\]What about finite $G$?",
    "original": "Let $G$ be a graph on at most $\\aleph_1$ vertices which contains no $K_4$ and no $K_{\\aleph_0,\\aleph_0}$ (the complete bipartite graph with $\\aleph_0$ vertices in each class). Is it true that\\[\\omega_1^2 \\to (\\omega_1\\omega, G)^2?\\]What about finite $G$?",
    "statement_sha256": "fe07f25d1aa66aa2a38fe4c38d34f867d0f0030056e5c5f45b1610ed36d99e22"
  },
  "subproblem_contract_sha256": "af72710893da03f81f4fe25e8617d168b53012b5de35335d68a42029b08dac61",
  "subproblem_id": "erdos-597-part-02-af727108"
}
