{
  "budget": "verified_pipeline_v2:4fc5421244b900bd",
  "model_portfolio": "chatgpt-5.6",
  "parent_problem_id": "erdos-80",
  "parent_run_contract_id": "0746bd55155a689869d8f371b17352c35a9d6fe53b59bfe28c03a9153b4646ed",
  "part_index": 1,
  "pipeline_version": "pipeline-content-sha256:d992243e6d1124da98218807bbcc1fed50496af96476673546f17c5c2eddd843",
  "priority_score": 0.086957,
  "problem_number": 80,
  "rank": 204,
  "recommended_attack_modes": [
    "statement_audit",
    "human_clarification",
    "subproblem_decomposition",
    "shared_infrastructure_search"
  ],
  "run_contract_id": "27f85776a5db4a8cbef5d387442df4c093ce3143473017f9cec66daa4af200e2",
  "schema_version": 2,
  "snapshot_id": "20260713-deb58d0facd9",
  "statement": {
    "focus_question": "Let $c>0$ and let $f_c(n)$ be the maximal $m$ such that every graph $G$ with $n$ vertices and at least $cn^2$ edges, where each edge is contained in at least one triangle, must contain a book of size $m$, that is, an edge shared by at least $m$ different triangles. \n\nEstimate $f_c(n)$. In particular, is it true that $f_c(n)>n^{\\epsilon}$ for some $\\epsilon>0$?",
    "focus_question_sha256": "8f461a2ff124188f21c594525519650588ba5c42761b548ae23b872b9f5f329a",
    "normalized": "Let $c>0$ and let $f_c(n)$ be the maximal $m$ such that every graph $G$ with $n$ vertices and at least $cn^2$ edges, where each edge is contained in at least one triangle, must contain a book of size $m$, that is, an edge shared by at least $m$ different triangles. Estimate $f_c(n)$. In particular, is it true that $f_c(n)>n^{\\epsilon}$ for some $\\epsilon>0$? Or $f_c(n)\\gg \\log n$?",
    "original": "Let $c>0$ and let $f_c(n)$ be the maximal $m$ such that every graph $G$ with $n$ vertices and at least $cn^2$ edges, where each edge is contained in at least one triangle, must contain a book of size $m$, that is, an edge shared by at least $m$ different triangles. \n\nEstimate $f_c(n)$. In particular, is it true that $f_c(n)>n^{\\epsilon}$ for some $\\epsilon>0$? Or $f_c(n)\\gg \\log n$?",
    "statement_sha256": "c6efc2cbb8ed3bf5da3661dfe305df018d9d4c85cbe6b434a992b2261410e99a"
  },
  "subproblem_contract_sha256": "598c0fb4568b94dfa4eb9aa9c16f03e273c16524007daf1eda8409ed40b888d8",
  "subproblem_id": "erdos-80-part-01-598c0fb4"
}
