{
  "budget": "verified_pipeline_v2:4fc5421244b900bd",
  "model_portfolio": "chatgpt-ui-unrecorded",
  "parent_problem_id": "erdos-33",
  "parent_run_contract_id": null,
  "part_index": 2,
  "pipeline_version": "pipeline-content-sha256:c47624a865d6293e2bc197d23e5c254726607fc551b5044240a65ea44240e6f7",
  "priority_score": 0.113821,
  "problem_number": 33,
  "rank": 50,
  "recommended_attack_modes": [
    "statement_audit",
    "human_clarification",
    "formal_search",
    "subproblem_decomposition",
    "shared_infrastructure_search",
    "literature_search"
  ],
  "run_contract_id": null,
  "schema_version": 2,
  "snapshot_id": "20260712-00e292c67dca",
  "statement": {
    "focus_question": "\\]Is\\[\\liminf \\frac{\\lvert A\\cap\\{1,\\ldots,N\\}\\rvert}{N^{1/2}}>1?",
    "focus_question_sha256": "030e81ca6dc7bdf6522d1817b753aaeef6b9b1c1623fb4e2f9c49a193f09e58e",
    "normalized": "Let $A\\subset\\mathbb{N}$ be such that every large integer can be written as $n^2+a$ for some $a\\in A$ and $n\\geq 0$. What is the smallest possible value of\\[\\limsup \\frac{\\lvert A\\cap\\{1,\\ldots,N\\}\\rvert}{N^{1/2}}?\\]Is\\[\\liminf \\frac{\\lvert A\\cap\\{1,\\ldots,N\\}\\rvert}{N^{1/2}}>1?\\]",
    "original": "Let $A\\subset\\mathbb{N}$ be such that every large integer can be written as $n^2+a$ for some $a\\in A$ and $n\\geq 0$. What is the smallest possible value of\\[\\limsup \\frac{\\lvert A\\cap\\{1,\\ldots,N\\}\\rvert}{N^{1/2}}?\\]Is\\[\\liminf \\frac{\\lvert A\\cap\\{1,\\ldots,N\\}\\rvert}{N^{1/2}}>1?\\]",
    "statement_sha256": "bd1c5040c9bec47ac447762c5c41b5d4c3c17bd8c94d775a19f4cb17a8038e29"
  },
  "subproblem_contract_sha256": "5a05ef0ca38d3f126da04594873e9f31c70d3eff6477da5cbe31152aa3ea90eb",
  "subproblem_id": "erdos-33-part-02-5a05ef0c"
}
