{
  "budget": "verified_pipeline_v2:4fc5421244b900bd",
  "model_portfolio": "chatgpt-ui-unrecorded",
  "parent_problem_id": "erdos-394",
  "parent_run_contract_id": null,
  "part_index": 1,
  "pipeline_version": "pipeline-content-sha256:c47624a865d6293e2bc197d23e5c254726607fc551b5044240a65ea44240e6f7",
  "priority_score": 0.113821,
  "problem_number": 394,
  "rank": 61,
  "recommended_attack_modes": [
    "statement_audit",
    "human_clarification",
    "formal_search",
    "subproblem_decomposition",
    "shared_infrastructure_search",
    "literature_search"
  ],
  "run_contract_id": null,
  "schema_version": 2,
  "snapshot_id": "20260712-00e292c67dca",
  "statement": {
    "focus_question": "Let $t_k(n)$ denote the least $m$ such that\\[n\\mid m(m+1)(m+2)\\cdots (m+k-1).\\]Is it true that\\[\\sum_{n\\leq x}t_2(n)\\ll \\frac{x^2}{(\\log x)^c}\\]for some $c>0$?",
    "focus_question_sha256": "a187b03aa8a9d56a08030fe2e96f069ee5f1b551fcb501823591e2609da268db",
    "normalized": "Let $t_k(n)$ denote the least $m$ such that\\[n\\mid m(m+1)(m+2)\\cdots (m+k-1).\\]Is it true that\\[\\sum_{n\\leq x}t_2(n)\\ll \\frac{x^2}{(\\log x)^c}\\]for some $c>0$? Is it true that, for $k\\geq 2$,\\[\\sum_{n\\leq x}t_{k+1}(n) =o\\left(\\sum_{n\\leq x}t_k(n)\\right)?\\]",
    "original": "Let $t_k(n)$ denote the least $m$ such that\\[n\\mid m(m+1)(m+2)\\cdots (m+k-1).\\]Is it true that\\[\\sum_{n\\leq x}t_2(n)\\ll \\frac{x^2}{(\\log x)^c}\\]for some $c>0$?\n\nIs it true that, for $k\\geq 2$,\\[\\sum_{n\\leq x}t_{k+1}(n) =o\\left(\\sum_{n\\leq x}t_k(n)\\right)?\\]",
    "statement_sha256": "7d287ee5a08082120a9c86ee23cc1fd1662267c7e24734795b50672ab71ab333"
  },
  "subproblem_contract_sha256": "ae72bb8b2aa9220194d66a9885b349d7fe976939556838c91c060a7cb5496b9e",
  "subproblem_id": "erdos-394-part-01-ae72bb8b"
}
