{
  "budget": "verified_pipeline_v2:4fc5421244b900bd",
  "model_portfolio": "chatgpt-5.6",
  "parent_problem_id": "erdos-675",
  "parent_run_contract_id": "24a9184656430b3073236ccdd79992f7638527215f3a672e2ee6464d2e3dad4d",
  "part_index": 3,
  "pipeline_version": "pipeline-content-sha256:d992243e6d1124da98218807bbcc1fed50496af96476673546f17c5c2eddd843",
  "priority_score": 0.043478,
  "problem_number": 675,
  "rank": 317,
  "recommended_attack_modes": [
    "statement_audit",
    "human_clarification",
    "subproblem_decomposition",
    "shared_infrastructure_search",
    "literature_search"
  ],
  "run_contract_id": "71c0f1e8d193498a12f470cf7bd7625e0bd507c69a92c2331dd57b2ce76f48de",
  "schema_version": 2,
  "snapshot_id": "20260713-deb58d0facd9",
  "statement": {
    "focus_question": "{/LI}\n{LI}If $A$ is the set of squarefree numbers then how fast does the minimal such $t_n$ grow?",
    "focus_question_sha256": "d8d401124e3f3c982a54ed1844d7b420574282a2061456dd6eec6a93974c063c",
    "normalized": "We say that $A\\subset \\mathbb{N}$ has the translation property if, for every $n$, there exists some integer $t_n\\geq 1$ such that, for all $1\\leq a\\leq n$,\\[a\\in A\\quad\\textrm{ if and only if }\\quad a+t_n\\in A.\\]{UL} {LI}Does the set of the sums of two squares have the translation property?{/LI} {LI}If we partition all primes into $P\\sqcup Q$, such that each set contains $\\gg x/\\log x$ many primes $\\leq x$ for all large $x$, then can the set of integers only divisible by primes from $P$ have the translation property?{/LI} {LI}If $A$ is the set of squarefree numbers then how fast does the minimal such $t_n$ grow? Is it true that $t_n>\\exp(n^c)$ for some constant $c>0$?{/LI} {/UL}",
    "original": "We say that $A\\subset \\mathbb{N}$ has the translation property if, for every $n$, there exists some integer $t_n\\geq 1$ such that, for all $1\\leq a\\leq n$,\\[a\\in A\\quad\\textrm{ if and only if }\\quad a+t_n\\in A.\\]{UL}\n{LI}Does the set of the sums of two squares have the translation property?{/LI}\n{LI}If we partition all primes into $P\\sqcup Q$, such that each set contains $\\gg x/\\log x$ many primes $\\leq x$ for all large $x$, then can the set of integers only divisible by primes from $P$ have the translation property?{/LI}\n{LI}If $A$ is the set of squarefree numbers then how fast does the minimal such $t_n$ grow? Is it true that $t_n>\\exp(n^c)$ for some constant $c>0$?{/LI}\n{/UL}",
    "statement_sha256": "d60b276afee2cb51887dbbace7e738779bde6011f10e1736134a87ff6978da71"
  },
  "subproblem_contract_sha256": "797383fad535d0ec7b8ea24679ad32a01a1edf58883ab5d90be05f45c0af0bad",
  "subproblem_id": "erdos-675-part-03-797383fa"
}
