{
  "budget": "verified_pipeline_v2:4fc5421244b900bd",
  "model_portfolio": "chatgpt-ui-unrecorded",
  "parent_problem_id": "erdos-883",
  "parent_run_contract_id": null,
  "part_index": 1,
  "pipeline_version": "pipeline-content-sha256:c47624a865d6293e2bc197d23e5c254726607fc551b5044240a65ea44240e6f7",
  "priority_score": 0.086957,
  "problem_number": 883,
  "rank": 218,
  "recommended_attack_modes": [
    "statement_audit",
    "human_clarification",
    "subproblem_decomposition",
    "shared_infrastructure_search",
    "literature_search"
  ],
  "run_contract_id": null,
  "schema_version": 2,
  "snapshot_id": "20260712-00e292c67dca",
  "statement": {
    "focus_question": "For $A\\subseteq \\{1,\\ldots,n\\}$ let $G(A)$ be the graph with vertex set $A$, where two integers are joined by an edge if they are coprime. Is it true that if\\[\\lvert A\\rvert >\\lfloor\\tfrac{n}{2}\\rfloor+\\lfloor\\tfrac{n}{3}\\rfloor-\\lfloor\\tfrac{n}{6}\\rfloor\\]then $G(A)$ contains all odd cycles of length $\\leq \\frac{n}{3}+1$?",
    "focus_question_sha256": "d6ed5a4f6e8753ac898779afe8c06848c6d2e8af0f334ff7d2313fbc5f54c010",
    "normalized": "For $A\\subseteq \\{1,\\ldots,n\\}$ let $G(A)$ be the graph with vertex set $A$, where two integers are joined by an edge if they are coprime. Is it true that if\\[\\lvert A\\rvert >\\lfloor\\tfrac{n}{2}\\rfloor+\\lfloor\\tfrac{n}{3}\\rfloor-\\lfloor\\tfrac{n}{6}\\rfloor\\]then $G(A)$ contains all odd cycles of length $\\leq \\frac{n}{3}+1$? Is it true that, for every $\\ell\\geq 1$, if $n$ is sufficiently large and\\[\\lvert A\\rvert >\\lfloor\\tfrac{n}{2}\\rfloor+\\lfloor\\tfrac{n}{3}\\rfloor-\\lfloor\\tfrac{n}{6}\\rfloor\\]then $G(A)$ must contain a complete $(1,\\ell,\\ell)$ triparite graph on $2\\ell+1$ vertices?",
    "original": "For $A\\subseteq \\{1,\\ldots,n\\}$ let $G(A)$ be the graph with vertex set $A$, where two integers are joined by an edge if they are coprime.\n\nIs it true that if\\[\\lvert A\\rvert >\\lfloor\\tfrac{n}{2}\\rfloor+\\lfloor\\tfrac{n}{3}\\rfloor-\\lfloor\\tfrac{n}{6}\\rfloor\\]then $G(A)$ contains all odd cycles of length $\\leq \\frac{n}{3}+1$?\n\nIs it true that, for every $\\ell\\geq 1$, if $n$ is sufficiently large and\\[\\lvert A\\rvert >\\lfloor\\tfrac{n}{2}\\rfloor+\\lfloor\\tfrac{n}{3}\\rfloor-\\lfloor\\tfrac{n}{6}\\rfloor\\]then $G(A)$ must contain a complete $(1,\\ell,\\ell)$ triparite graph on $2\\ell+1$ vertices?",
    "statement_sha256": "42b1e16f4bd3b2e2185d03c68112158ea913c9d5e0072b8faebab3b8d89b9e8d"
  },
  "subproblem_contract_sha256": "4d0f538e917448762bb44d72fd6b0eb93f39d386daeaa5e5f677252b82cd9b33",
  "subproblem_id": "erdos-883-part-01-4d0f538e"
}
