{
  "budget": "verified_pipeline_v2:4fc5421244b900bd",
  "model_portfolio": "chatgpt-5.6",
  "parent_problem_id": "erdos-529",
  "parent_run_contract_id": "c3a3a64b6c915c654a23b7f6fab1e2a11da1ea85ceefa32d0527cc78570cdc35",
  "part_index": 1,
  "pipeline_version": "pipeline-content-sha256:d992243e6d1124da98218807bbcc1fed50496af96476673546f17c5c2eddd843",
  "priority_score": 0.086957,
  "problem_number": 529,
  "rank": 160,
  "recommended_attack_modes": [
    "statement_audit",
    "human_clarification",
    "subproblem_decomposition",
    "shared_infrastructure_search"
  ],
  "run_contract_id": "e1599d3bb15f693c4b20ab781acbc731964a57ed8b5f64e00f4c41b001c8d44f",
  "schema_version": 2,
  "snapshot_id": "20260713-deb58d0facd9",
  "statement": {
    "focus_question": "Let $d_k(n)$ be the expected distance from the origin after taking $n$ random steps from the origin in $\\mathbb{Z}^k$ (conditional on no self intersections) - that is, a self-avoiding walk. Is it true that\\[\\lim_{n\\to \\infty}\\frac{d_2(n)}{n^{1/2}}= \\infty?",
    "focus_question_sha256": "489019770c16f3d94ab2b52335bedc7df158daacd160eaa00410c6f895b4b318",
    "normalized": "Let $d_k(n)$ be the expected distance from the origin after taking $n$ random steps from the origin in $\\mathbb{Z}^k$ (conditional on no self intersections) - that is, a self-avoiding walk. Is it true that\\[\\lim_{n\\to \\infty}\\frac{d_2(n)}{n^{1/2}}= \\infty?\\]Is it true that\\[d_k(n)\\ll n^{1/2}\\]for $k\\geq 3$?",
    "original": "Let $d_k(n)$ be the expected distance from the origin after taking $n$ random steps from the origin in $\\mathbb{Z}^k$ (conditional on no self intersections) - that is, a self-avoiding walk. Is it true that\\[\\lim_{n\\to \\infty}\\frac{d_2(n)}{n^{1/2}}= \\infty?\\]Is it true that\\[d_k(n)\\ll n^{1/2}\\]for $k\\geq 3$?",
    "statement_sha256": "f73f44ec6bbae51e242dfc5c538ae93ee54df367911876406032377e995ff3cb"
  },
  "subproblem_contract_sha256": "ae4a96855671fbf873cc2d6ac39cbcb25ae75d28259fb615092e841cacb09ecb",
  "subproblem_id": "erdos-529-part-01-ae4a9685"
}
