{
  "budget": "verified_pipeline_v2:4fc5421244b900bd",
  "model_portfolio": "chatgpt-ui-unrecorded",
  "parent_problem_id": "erdos-662",
  "parent_run_contract_id": null,
  "part_index": 1,
  "pipeline_version": "pipeline-content-sha256:c47624a865d6293e2bc197d23e5c254726607fc551b5044240a65ea44240e6f7",
  "priority_score": 0.086957,
  "problem_number": 662,
  "rank": 180,
  "recommended_attack_modes": [
    "statement_audit",
    "human_clarification",
    "subproblem_decomposition",
    "shared_infrastructure_search",
    "literature_search"
  ],
  "run_contract_id": null,
  "schema_version": 2,
  "snapshot_id": "20260712-00e292c67dca",
  "statement": {
    "focus_question": "Consider the triangular lattice with minimal distance between two points $1$. Denote by $f(t)$ the number of distances from any points $\\leq t$. For example $f(1)=6$, $f(\\sqrt{3})=12$, and $f(3)=18$.\n\nLet $x_1,\\ldots,x_n\\in \\mathbb{R}^2$ be such that $d(x_i,x_j)\\geq 1$ for all $i\\neq j$. Is it true that, provided $n$ is sufficiently large depending on $t$, the number of distances $d(x_i,x_j)\\leq t$ is less than or equal to $f(t)$ with equality perhaps only for the triangular lattice?",
    "focus_question_sha256": "db08cb211b6a90760e38a2e86adfbc8b51751e82b7939e952dbc66478119bfe9",
    "normalized": "Consider the triangular lattice with minimal distance between two points $1$. Denote by $f(t)$ the number of distances from any points $\\leq t$. For example $f(1)=6$, $f(\\sqrt{3})=12$, and $f(3)=18$. Let $x_1,\\ldots,x_n\\in \\mathbb{R}^2$ be such that $d(x_i,x_j)\\geq 1$ for all $i\\neq j$. Is it true that, provided $n$ is sufficiently large depending on $t$, the number of distances $d(x_i,x_j)\\leq t$ is less than or equal to $f(t)$ with equality perhaps only for the triangular lattice? In particular, is it true that the number of distances $\\leq \\sqrt{3}-\\epsilon$ is less than $1$?",
    "original": "Consider the triangular lattice with minimal distance between two points $1$. Denote by $f(t)$ the number of distances from any points $\\leq t$. For example $f(1)=6$, $f(\\sqrt{3})=12$, and $f(3)=18$.\n\nLet $x_1,\\ldots,x_n\\in \\mathbb{R}^2$ be such that $d(x_i,x_j)\\geq 1$ for all $i\\neq j$. Is it true that, provided $n$ is sufficiently large depending on $t$, the number of distances $d(x_i,x_j)\\leq t$ is less than or equal to $f(t)$ with equality perhaps only for the triangular lattice?\n\nIn particular, is it true that the number of distances $\\leq \\sqrt{3}-\\epsilon$ is less than $1$?",
    "statement_sha256": "84f511207437a2e2960ef5affc4f23cae7c5f52b0662cd128a3d3a88281692e4"
  },
  "subproblem_contract_sha256": "94c473493d62ee939e9bf4a0e1aab282e2c09c21b684a3ae029095c7c2721397",
  "subproblem_id": "erdos-662-part-01-94c47349"
}
