{
  "budget": "verified_pipeline_v2:4fc5421244b900bd",
  "model_portfolio": "chatgpt-ui-unrecorded",
  "parent_problem_id": "erdos-878",
  "parent_run_contract_id": null,
  "part_index": 3,
  "pipeline_version": "pipeline-content-sha256:c47624a865d6293e2bc197d23e5c254726607fc551b5044240a65ea44240e6f7",
  "priority_score": 0.043478,
  "problem_number": 878,
  "rank": 325,
  "recommended_attack_modes": [
    "statement_audit",
    "human_clarification",
    "subproblem_decomposition",
    "shared_infrastructure_search",
    "literature_search"
  ],
  "run_contract_id": null,
  "schema_version": 2,
  "snapshot_id": "20260712-00e292c67dca",
  "statement": {
    "focus_question": "\\]Is it true that (for all $x$, or perhaps just for all large $x$)\\[\\max_{n\\leq x}f(n)=\\max_{n\\leq x}F(n)?",
    "focus_question_sha256": "55ba02a29eb659c6896d3cd551d88d0d7df0087dbe63948bf939732df3f69fd6",
    "normalized": "If $n=\\prod_{1\\leq i\\leq t} p_i^{k_i}$ is the factorisation of $n$ into distinct primes then let\\[f(n)=\\sum p_i^{\\ell_i},\\]where $\\ell_i$ is chosen such that $n\\in [p_i^{\\ell_i},p_i^{\\ell_i+1})$. Furthermore, let\\[F(n)=\\max \\sum_{i} a_i\\]where the maximum is taken over all distinct $a_1,\\ldots,a_k\\leq n$ such that $(a_i,a_j)=1$ for $i\\neq j$ and all prime factors of each $a_i$ are prime factors of $n$. Is it true that, for almost all $n$,\\[f(n)=o(n\\log\\log n)\\]and\\[F(n) \\gg n\\log\\log n?\\]Is it true that\\[\\max_{n\\leq x}f(n)\\sim \\frac{x\\log x}{\\log\\log x}?\\]Is it true that (for all $x$, or perhaps just for all large $x$)\\[\\max_{n\\leq x}f(n)=\\max_{n\\leq x}F(n)?\\]Find an asymptotic formula for the number of $n<x$ such that $f(n)=F(n)$. Find an asymptotic formula for\\[H(x)=\\sum_{n<x}\\frac{f(n)}{n}.\\]Is it true that\\[H(x) \\ll x\\log\\log\\log\\log x?\\]",
    "original": "If $n=\\prod_{1\\leq i\\leq t} p_i^{k_i}$ is the factorisation of $n$ into distinct primes then let\\[f(n)=\\sum p_i^{\\ell_i},\\]where $\\ell_i$ is chosen such that $n\\in [p_i^{\\ell_i},p_i^{\\ell_i+1})$. Furthermore, let\\[F(n)=\\max \\sum_{i} a_i\\]where the maximum is taken over all distinct $a_1,\\ldots,a_k\\leq n$ such that $(a_i,a_j)=1$ for $i\\neq j$ and all prime factors of each $a_i$ are prime factors of $n$.\n\nIs it true that, for almost all $n$,\\[f(n)=o(n\\log\\log n)\\]and\\[F(n) \\gg n\\log\\log n?\\]Is it true that\\[\\max_{n\\leq x}f(n)\\sim \\frac{x\\log x}{\\log\\log x}?\\]Is it true that (for all $x$, or perhaps just for all large $x$)\\[\\max_{n\\leq x}f(n)=\\max_{n\\leq x}F(n)?\\]Find an asymptotic formula for the number of $n<x$ such that $f(n)=F(n)$. Find an asymptotic formula for\\[H(x)=\\sum_{n<x}\\frac{f(n)}{n}.\\]Is it true that\\[H(x) \\ll x\\log\\log\\log\\log x?\\]",
    "statement_sha256": "1188c9c6a00731e8bbb24695bd8231a724acf92a459068224ec27a62aae0bfc6"
  },
  "subproblem_contract_sha256": "c645530b88e10d9ec5ae1500bd0a5df137102784a214e87f071e740799f45367",
  "subproblem_id": "erdos-878-part-03-c645530b"
}
