{
  "budget": "verified_pipeline_v2:4fc5421244b900bd",
  "model_portfolio": "chatgpt-5.6",
  "parent_problem_id": "erdos-875",
  "parent_run_contract_id": "70d4c50068f3c64ac43be367457161921bb35275810b4468d4f39979754c4289",
  "part_index": 2,
  "pipeline_version": "pipeline-content-sha256:d992243e6d1124da98218807bbcc1fed50496af96476673546f17c5c2eddd843",
  "priority_score": 0.057971,
  "problem_number": 875,
  "rank": 299,
  "recommended_attack_modes": [
    "statement_audit",
    "human_clarification",
    "subproblem_decomposition",
    "shared_infrastructure_search",
    "literature_search"
  ],
  "run_contract_id": "837aa3e84d36f895d5864e632b4083c2e9d02a51baab3c383e184c23dfa6a40b",
  "schema_version": 2,
  "snapshot_id": "20260713-deb58d0facd9",
  "statement": {
    "focus_question": "How small can $a_{n+1}-a_n$ be?",
    "focus_question_sha256": "cdd143e3651f87f3f64818f45c8b2abfc7f6059786249c10846ddd05668063f3",
    "normalized": "Let $A=\\{a_1<a_2<\\cdots\\}\\subset \\mathbb{N}$ be an infinite set such that the sets\\[S_r = \\{ a_1+\\cdots +a_r : a_1<\\cdots<a_r\\in A\\}\\]are disjoint for distinct $r\\geq 1$. How fast can such a sequence grow? How small can $a_{n+1}-a_n$ be? In particular, for which $c$ is it possible that $a_{n+1}-a_n\\leq n^{c}$?",
    "original": "Let $A=\\{a_1<a_2<\\cdots\\}\\subset \\mathbb{N}$ be an infinite set such that the sets\\[S_r = \\{ a_1+\\cdots +a_r : a_1<\\cdots<a_r\\in A\\}\\]are disjoint for distinct $r\\geq 1$. How fast can such a sequence grow? How small can $a_{n+1}-a_n$ be? In particular, for which $c$ is it possible that $a_{n+1}-a_n\\leq n^{c}$?",
    "statement_sha256": "da2994349699a6b4ef987e8623485eb8297d40fe91c07d2317bcb597c3769bb5"
  },
  "subproblem_contract_sha256": "6ee22c9a34dbce3832605241239f4834b1da76d468e0d3d17a1a6ebd2050deeb",
  "subproblem_id": "erdos-875-part-02-6ee22c9a"
}
